Date;Title;Text;Source
14/01/2018;Lactalis offers salmonella compensation, French govt says probe continues;"* Salmonella found in Lactalis' Craon
plant, operations shutdown
* Three dozen children have fallen ill,
lawsuits loom
* Global recall involves 83 countries
(Recasts with government spokesman)
By Richard Lough
PARIS, Jan 14 (Reuters) - France welcomed
dairy group Lactalis' pledge to
compensate victims of a Salmonella
contamination in its baby milk on Sunday,
but said a judicial investigation to
determine who was responsible would
continue.
Lactalis Chief Executive Emmanuel
Besnier told the weekly Journal du Dimanche
his family company, one of the
world's biggest dairies, would ""pay
damages to every family which has suffered
a prejudice"".
Salmonella infections can be lifethreatening
and the families of three
dozen children who have fallen sick in
France as a result of the contaminated
baby milk have announced a raft of lawsuits.
Besnier's promise came two days after
Lactalis widened a product recall to cover
all infant formula made at its Craon
plan, regardless of the manufacture date,
in an bid to contain the fallout from a
health scare that risks damaging
France's strategic agribusiness in overseas
markets.
""Paying compensation is good, but money
cannot buy everything,"" government
spokesman Benjamin Griveaux said in
an interview on BFM TV.
The health scare intensified last week
after France's biggest retailers including
Carrefour, Auchan and Leclerc admitted
products recalled in December had still
found their way onto shelves.
""It is the job of the investigation to determine
where failings occurred and
who is to blame,"" Griveaux said, adding
that ""responsibilities were shared"".
Besnier did not say how much the damages
might amount to.
Implementing the global recall will be
challenging. Privately owned Lactalis,
one of the world's biggest dairies, exports
its baby food products to 83 countries
across Europe, Africa and Asia.
CLUMSY RESPONSE
The recall involves some 12 million tins
of baby milk.
""It's not easy to evaluate the number of
items that need to be returned because
we don't know what's been consumed already,"" Besnier said in a rare newspaper
interview published on Sunday.
Friday's recall was the third in a month
and Lactalis has come under fire for its
clumsy response. Besnier also told the
French weekly that the company had
acted as quickly and efficiently as possible
and denied slowing the process to
curb losses.
Besnier has also been criticised for failing
to speak out publicly during the salmonella
scare.
While his family are France's 11th
wealthiest, according to a 2017 ranking
by Challenges magazine, the dairy tycoon
has long shunned the public limelight
and schmoozing with politicians.
His workers nickname him the ""invisible
man.""
""We're a discreet business. In this region
there is a mentality of 'work first, speak
later,"" he said. But he acknowledged
lessons had been learned during the past
few weeks.
Lactalis has become an industry giant,
with annual sales of 17 billion euros
($20.73 billion) and 18,900 employees
across some 40 countries.
He said the Craon plant was likely to remain
closed for several months.
The recall risks damaging Lactalis in
China, a fast-growing market for baby
food and dairy products where scares after
melamine-tainted baby milk led to
the deaths of six children in 2008.
That scandal caused distrust in locally
produced infant formula and benefited
foreign suppliers such as Nestle,
Danone and Lactalis.";Reuters
14/01/2018;Lactalis CEO breaks silence over salmonella-tainted baby milk;"The
chief executive of France's
Lactalis group on Sunday
vowed compensation for victims of salmonella-
tainted baby milk, as he revealed
that recalls were now under way
in 83 countries.
Emmanuel Besnier, giving his first interview
in nearly 20 years as head of
the family-controlled company, told the
Journal du Dimanche newspaper that the
recall involved more than 12 million
packages of Picot, Milumel, Celia and
other brands of powdered baby milk.
""We are going to draw the lessons from
this crisis and set out an even stricter hygiene
framework, in collaboration with
the authorities,"" he said.
Asked why he had not publicly addressed
earlier parents' concerns as worries
about the outbreak intensified,
Besnier said: ""It's true, by nature I'm not
very forthcoming.""
""In a crisis like this, we act first, and
perhaps I didn't take the necessary time
to explain things.""
A total of 37 babies have fallen ill in
France as a result of the contamination,
health authorities said late Friday, along
with a case in Spain and a suspected
case in Greece.
But Besnier said no new cases had been
reported since December 8, a week after
the recall was announced.
The French government welcomed the
pledge to reimburse victims, but said investigations
would continue to determine
why the contamination went undetected.
Officials will also investigate why in
some cases the affected milk continued
to be distributed in supermarkets, pharmacies
and even some hospitals after the
recall was announced.
""When you have a case of milk on the
market which has clearly caused complicated
health problems for children, it
means at some point there was negligence,""
government spokesman Benjamin
Griveaux told BFM television
Sunday.
Besnier's explanations ""have not been
sufficient,"" he added, vowing that the investigations
""will not spare anyone"", including
the French state.
- 'Not hiding things' -
Besnier's interview with the newspaper
included two of the first public photographsof
the secretive leader in years,
at the Lactalis headquarters in Laval,
western France.
Created in 1933 by Besnier's grandfather,
Lactalis has become an industry
behemoth with annual sales of some 17
billion euros ($20.6 billion), making it
the world's third-largest dairy group, behind
Danone and Nestle. The interview came after French finance
minister Bruno Le Maire summoned
Besnier to a meeting over the crisis on
Friday, in which the chief executive
agreed to pull from store and pharmacy
shelves all products from the Craon factory
where the outbreak was found.
But Besnier did not appear with Le
Maire at a press conference after the
meeting, despite calls by several government
officials for him to face the
public.
Hundreds of lawsuits have been filed
against the group by families who say
their children got salmonella poisoning
after drinking powdered milk made by
the company.
Richard Ferrand, leader of President
Emmanuel Macron's LREM lawmakers
in parliament, said all efforts would be
made to find the causes of the crisis, and
did not rule out the creation of a parliamentary
inquiry, sought by opposition
groups.
But Besnier, 47, denied claims by an association
of victims' families that Lactalis
had lied about the dates and number
of stocks affected by the salmonella outbreak.
""At no point was there any intention of
hiding things,"" he said.
- 'Buy our silence' -
But the company's promise of compensation
did not impress Quentin Guillemain,
president of the Lactalis victim's
association.
""They are trying to buy our silence,"" he
told AFP.
""We want the truth,"" he added, berating
Lactalis for failing to provide apologies
or explanations.
""Mr Besnier speaks of 83 countries affected...
Where are these figures from?
Have all the authorities been informed?
We are waiting for answers,"" said
Guillemain.
Besnier meanwhile also defended the
decision not to inform the authorities
that internal tests had discovered salmonella
on a broom and on the tiles of
a dehydration tower at the company's
Craon factory in August and November
last year.
""For us, these 'environment' tests are an
alert to make sure we keep the bacteria
far from the product,"" he said, adding
that authorities would have been alerted
only if bacteria were found in the powdered
milk.
The salmonella scare has cast a harsh
spotlight on an executive and a company
little known to the public, despite employing
15,000 people in France, where
milk and cheese are proudly considered
part of the country's heritage.
Analysts say the crisis could dent the
company's reputation among anxious
parents worldwide.";AFP
14/01/2018;83 countries affected by Lactalis salmonella scandal: CEO;"A salmonella scandal
at French dairy group Lactalis
has affected 83 countries,
where 12 million boxes of powdered baby
milk are being recalled, the company's
CEO said Sunday in an interview
with French media.
Emmanuel Besnier, scion of the secretive
family behind one of the world's
biggest dairy groups, was speaking publicly
for the first time since an outcry
erupted over claims the company hid the
salmonella outbreak at a plant making
the product.
""We must take account the scale of this
operation: more than 12 million boxes
are affected,"" he said, adding that distributors
would no longer have to sort
through the produce to find the contaminated
powder. ""They know that everything
has to be removed from the
shelves,"" Besnier said.
Besnier, who was summoned to the
French finance ministry on Friday,
promised compensation for all the families
affected.
He said that the consequences of this
health crisis for consumers, including
babies under six months, were at the
forefront of his mind. ""It is for us, for
me, a great concern,"" he told the Journal
du Dimanche.
Hundreds of lawsuits have been filed
against the group by families who say
DAMIEN MEYER
A mural showing some of cheeses and
other products made by Lactalis, the French
dairy giant, on a wall of its headquarters in
Laval, western France
their children got salmonella poisoning
after drinking powdered milk made by
the company.
So far French officials have reported 35
cases of infants getting salmonella from
the powder, while one case has been reported
in Spain and another is being investigated
in Greece.
An association representing victims
says the authorities are underestimating
the number of cases.
""There are complaints and there will be
an investigation with which we will fully
collaborate. We never thought to act
otherwise,"" Besnier said.
Created in 1933 by Besnier's grandfather,
Lactalis has become an industry
behemoth with annual sales of some 17
billion euros ($20.6 billion), with products
including Galbani ricotta and mozzarella
in Italy. With 246 production sites in 47 countries,
its list of products also features
household names like President butter
and Societe roquefort.
Two of those brands, Picot and Milumel
baby milk, were the subject of chaotic
international recalls issued in mid-
December after dozens of children fell
sick.
The scandal deepened this month when
French investigative weekly Le Canard
Enchaine reported that state inspectors
had given a clean bill of health to the
Lactalis site in Craon, northwest France,
in early September.
They failed to find the salmonella bacteria
that had been detected by Lactalis's
own tests in August and November,
which were not reported to the authorities.
The company said it was not legally
bound to report the contamination.";AFP
14/01/2018;83 countries affected by Lactalis salmonella scandal: CEO;"A
salmonella scandal at French
dairy group Lactalis has affected
83 countries, where 12 million boxes
of powdered baby milk are being recalled,
the company's CEO said Sunday
in an interview with French media.
Emmanuel Besnier, scion of the secretive
family behind one of the world's
biggest dairy groups, was speaking publicly
for the first time since an outcry
erupted over claims the company hid the
salmonella outbreak at a plant making
the product.
""We must take account the scale of this
operation: more than 12 million boxes
are affected,"" he said, adding that distributors
would no longer have to sort
through the produce to find the contaminated
powder. ""They know that everything
has to be removed from the
shelves,"" Besnier said.
Besnier, who was summoned to the
French finance ministry on Friday,
promised compensation for all the families
affected.
He said that the consequences of this
health crisis for consumers, including
babies under six months, were at the
forefront of his mind. ""It is for us, for
me, a great concern,"" he told the Journal
du Dimanche.
Hundreds of lawsuits have been filed
against the group by families who say
their children got salmonella poisoning
after drinking powdered milk made by
the company.
So far French officials have reported 35
cases of infants getting salmonella from
the powder, while one case has been reported
in Spain and another is being investigated
in Greece.
An association representing victims
says the authorities are underestimating
the number of cases.
""There are complaints and there will be
an investigation with which we will fully
collaborate. We never thought to act
otherwise,"" Besnier said.
Created in 1933 by Besnier's grandfather,
Lactalis has become an industry
behemoth with annual sales of some 17
billion euros ($20.6 billion), with products
including Galbani ricotta and mozzarella
in Italy.
With 246 production sites in 47 countries,
its list of products also features
household names like President butter
and Societe roquefort.
Two of those brands, Picot and Milumel
baby milk, were the subject of chaotic
international recalls issued in mid-
December after dozens of children fell
sick.
The scandal deepened this month when
French investigative weekly Le Canard
Enchaine reported that state inspectors
had given a clean bill of health to the Lactalis site in Craon, northwest France,
in early September.
They failed to find the salmonella bacteria
that had been detected by Lactalis's
own tests in August and November,
which were not reported to the authorities.
The company said it was not legally
bound to report the contamination.";AFP
14/01/2018;Embattled French dairy chief breaks silence over salmonella scare;"The
chief executive of France's
Lactalis group on Sunday
vowed compensation for victims of salmonella-
tainted baby milk, as he revealed
that recalls were now under way
in 83 countries.
Emmanuel Besnier, giving his first interview
in nearly 20 years as head of
the family-controlled company, told the
Journal du Dimanche newspaper that the
recall involved more than 12 million
packages of Picot, Milumel, Celia and
other brands of powdered baby milk.
""We are going to draw the lessons from
this crisis and set out an even stricter hygiene
framework, in collaboration with
the authorities,"" he said.
Asked why he had not publicly addressed
parents' concerns as worries
about the outbreak intensified, Besnier
said: ""It's true, by nature I'm not very
forthcoming.""
""In a crisis like this, we act first, and
perhaps I didn't take the necessary time
to explain things.""
A total of 37 babies have fallen ill in
France as a result of the contamination,
health authorities said late Friday, along
with a case in Spain and a suspected
case in Greece, but Besnier said no new
cases had been reported since December
8, a week after the recall was announced.
The French government welcomed the
pledge to reimburse victims, but said investigations
would continue to determine
why the contamination went undetected.
Officials will also investigate why in
some cases the affected milk continued
to be distributed in supermarkets, pharmacies
and even some hospitals after the
recall was announced.
""Compensation is good, but money can't
buy everything,"" government
spokesman Benjamin Griveaux told
BFM television Sunday.
""When you have a case of milk on the
market which has clearly caused complicated
health problems for children, it
means at some point there was negligence,""
Griveaux said.
Besnier's explanations ""at this point""
have not been sufficient, he added, vowing
that the investigations ""will not
spare anyone"", including the French
state.
- 'Not hiding things' -
Besnier's interview included two of the
first public photographs of the secretive
leader in years, at the Lactalis headquarters
in Laval, western France It came after French finance minister
Bruno Le Maire summoned Besnier to a
meeting over the crisis Friday, in which
the chief executive agreed to pull from
store and pharmacy shelves all products
from the Craon factory where the outbreak
was found, instead of just those
dating back to February.
But Besnier did not appear with Le
Maire at a press conference after the
meeting, despite calls by several government
officials for him to face the
public.
Hundreds of lawsuits have been filed
against the group by families who say
their children got salmonella poisoning
after drinking powdered milk made by
the company.
Richard Ferrand, leader of President
Emmanuel Macron's LREM lawmakers
in parliament, said all efforts would be
made to find the causes of the crisis, and
did not rule out the creation of a parliamentary
inquiry, sought by opposition
groups.
But Besnier, 47, denied claims by an association
of victims' families that Lactalis
had lied about the dates and number
of stocks affected by the salmonella outbreak.
""This is false. I don't know what this
claim is based on,"" he said.
""At no point was there any intention of
hiding things.""
- Harsh spotlight -
Besnier also defended the decision not
to inform the authorities that internal
tests had discovered salmonella on a
broom and on the tiles of a dehydration
tower at the company's Craon factory in
August and November last year.
""For us, these 'environment' tests are an
alert to make sure we keep the bacteria
far from the product,"" he said, adding
that authorities would have been alerted
only if bacteria were found in the powdered
milk.
Created in 1933 by Besnier's grandfather,
Lactalis has become an industry
behemoth with annual sales of some 17
billion euros ($20.6 billion), making it
the world's third-largest dairy group, behind
Danone and Nestle.
The salmonella scare has cast a harsh
spotlight on an executive and a company
little known to the public, despite employing
15,000 people in France, where
milk and cheese are proudly considered
part of the country's heritage.
Analysts say the crisis could dent the
company's reputation among anxious
parents worldwide.
""This recall may undermine consumer
trust in milk formula brands produced
using milk from French farms in the
emerging markets affected by the recall,
which includes China,"" said Raphael
Moreau, a senior analyst at Euromonitor.";AFP
12/01/2018;France's Lactalis forced into new recall in baby milk scare;"* Salmonella contamination identified
at Lactalis plant late 2017
* Scare deepened when retailers said recalled
goods still on sale
* Lactalis sells baby milk in Europe,
Africa and Asia (Adds more Le Maire
quotes, context)
By Richard Lough and Gus Trompiz
PARIS, Jan 12 (Reuters) - French dairy
group Lactalis is widening a product recall
to cover all baby milk manufactured
by a factory at the centre of a salmonella
contamination, Finance minister Bruno
Le Maire said on Friday.
The move comes as the government
seeks to contain reputational damage to
France's strategic agri-business industry
in overseas markets. Three dozen children
have fallen ill in France and at least
one other in Spain.
After talks with Lactalis management
Le Maire said the company would recall
all infant formula milk products made at
its Craon factory that were still in warehouses
and on store shelves, regardless
of the date of manufacture.
""The aim of this radical step is simple:
to avoid delays, problems in sorting
batches and the risk of human error,"" Le
Maire told a news conference on Friday.
In a later statement Lactalis confirmed
the extended recall and pledged to find
and eradicate the causes of the salmonella
contamination.
Implementing the recall will be challenging.
Privately owned Lactalis exports
its products to dozens of countries
across Europe, Africa and Asia.
The tough measure reflects high-level
frustration at the botched handling of the
crisis after France's biggest supermarkets
-- including Carrefour, Auchan and
Leclerc -- this week said that some Lactalis
products subject to recalls in December
still found their way onto their
shelves.
It has been particularly embarrassing for
the government after President Emmanuel
Macron pushed food exports
during a state visit to China this week.
Salmonella infections can be lifethreatening,
particularly for young children,
and the recall risks damaging Lactalis
in China. Consumers in China, a
fast-growing market for baby food and
dairy products, are particularly sensitive
to such scares after melamine-tainted
baby milk led to the deaths of six children
in 2008.
That scandal caused distrust in locally
produced infant formula and benefited
foreign suppliers such as Nestle,
Danone and Lactalis. ""I cannot guarantee that right now there
isn't a single tin of baby milk left on a
shelf in a giant warehouse or in a pharmacy,""
Le Maire said. ""I think this (further
recall) is the strongest guarantee we
can give.""
Le Maire did not say what volume of baby
milk could be involved beyond the
more than 12 million items already recalled
last month.
The European Centre for Disease Prevention
and Control said on Jan. 5 that
one infant in Spain had fallen ill with
a salmonella infection linked to contaminated
Lactalis baby milk and another
case in Greece was thought to be related.
A judicial investigation is taking place
in France over the contamination and a
group of French parents of affected infants
said on Friday that they were considering
a joint lawsuit.";Reuters
